"","Artista","Obra","Fecha","Texto","Tema"
"18","Ernst Ludwig Kirchner","Cocina alpina","1918","
                Kirchner es uno de los fundadores del grupo expresionista alemán Die Brücke (El Puente), así llamado por «el paso de una a otra orilla» en alusión a su voluntad de ruptura con el arte académico y su aspiración a una síntesis entre el mundo exterior y la propia psique del artista, entre el arte y la vida. Su movilización en la Primera Guerra Mundial le causó un fuerte deterioro en su salud, que determinó su inhabilitación en 1915 y su consiguiente retiro a las montañas suizas. Durante el verano de 1918, el artista se instaló en una cabaña alpina en Staffelalp, cuyo interior reproduce en este lienzo con estridentes colores, perspectivas distorsionadas y trazos angulosos que delatan la inquietud psíquica del autor, quizás la figura que aparece representada junto a la mesa.
En la cocina de la casa de Kirchner aparece una botella de vino italiano, con su forma abombada y su forro de paja, conocida como fiasco. Esta botella —empleada en Italia al menos desde el Renacimiento— se empezó a utilizar desde finales del siglo XIX para permitir la identificación en el exterior de los vinos de mesa italianos, por más que el grueso del vino del país se vendiera a granel. El Estado italiano se embarcó en una política activa de promoción de sus vinos desde la década de 1880. El objetivo de esta política era promover las ventas exteriores, en competencia clara con la vinicultura española, pues una y otra contaban con elevados excedentes de vinos de pasto. En este segmento, Italia gozaba de algunas ventajas como la presencia de nutridas comunidades de inmigrantes en los Estados Unidos y el Río de la Plata, que demandaban el vino italiano con preferencia a cualquier otro. Centroeuropa (Suiza y Alemania), como refleja este cuadro, fue otra de las salidas del vino común italiano, beneficiario de la cercanía geográfica y de las intensas relaciones comerciales entre el Norte del país y las regiones alpinas. Italia y España se especializaron en la exportación de vinos comunes, con lo que compitieron vía precios para colocar un vino destinado a ser materia prima para el coupage —la mezcla— de otros extranjeros, especialmente franceses, o al con- sumo popular. La especialización en vinos comunes, más marcada incluso en Italia que en España, respondía en buena medida a las reducidas dimensiones del mercado interior para los vinos de calidad, lo que dificultaba la consolidación de vinos tipificados y marcas exclusivas.
Tras la formación del Mercado Común, Italia se benefició a medio plazo de las ventajas arancelarias para aventajar a España en la comercialización exterior de los vinos de pasto. Únicamente en la década de 1960 se consolidó en ambos países un segmento de bodegas orientadas al consumo de las nuevas clases medias, a partir de las que en fechas posteriores surgieron la mayoría de los vinos de calidad en ambos países, considerándolo una auténtica revolución enológica. 
            ","vino"
"19","Juan Gris","Botella y frutero","1919","
                Juan Gris, una de las principales figuras del movimiento cubista, emplea en este bodegón un cromatismo de marrones cálidos combinados con verdes y grises más fríos. Con estas palabras expresaba en una carta de 1918 su deseo de experimentar con tonos naturales inspirados en el paisaje: «Veo en el campo tonos tan sólidos y tan sabrosos de materia y combinaciones tan verdaderas que llevan en ellos mucha más fuerza que todas las combinaciones de la paleta y con ellos me gustaría trabajar».
Como es habitual en el cubismo, Juan Gris juega con la tipografía para explotar sus recursos expresivos. Le Jour, día en francés, podría ser un fragmento del periódico Le Journal, pero también —modificando algunas letras— remitiría a Jouer (jugar) o jouir(gozar), en uno de esos juegos de palabras a los que tan aficionados fueron los artistas del movimiento. En el cuadro de Gris, pintado al término de la Primera Guerra Mundial, se yuxtaponen un frutero y dos símbolos de la sociedad de masas, críticamente descrita diez años más tarde por Ortega y Gasset en su obra La rebelión de las masas: el vino y el periódico. Se trata desde luego de símbolos muy diferentes, por cuanto que la prensa pasó por entonces a ser un fenómeno de masas en todo Occidente, mientras que la botella de vino se refería a un producto de consumo masivo en la sociedad francesa de la época.
Aunque las estadísticas existentes reflejan un crecimiento tendencial del consumo de vino en ese país a lo largo de todo el siglo XIX, la Primera Guerra Mundial supuso un salto claro en la serie. La gigantesca masa de poilus, de reclutas, que la guerra obligó a movilizar, fueron generosamente surtidos de vino por la intendencia militar francesa. Millones de jóvenes volvieron del frente acostumbrados a beber una cantidad elevada de vino de forma cotidiana: el consumo per cápita situado en 103 litros al año en 1904, pasó en 1922 a 136. Este consumo masivo, aprovisionado por la viticultura francesa —sobre todo la de Languedoc— y argelina, que en los años de mala cosecha exigía además importaciones de España e Italia, no fue un obstáculo para el desarrollo de la vinicultura de calidad y para la consolidación de la hegemonía francesa en los mercados internacionales de vinos superiores.
Es más, en un proceso característico de diferenciación social del consumo, el recurso a los vins ordinaires por parte de los trabajadores y campesinos de Francia potenció el consumo de vinos de calidad por parte de las clases medias. El aumento de la demanda no evitó reiteradas crisis de sobreproducción en el periodo de entreguerras. A lo largo de la Gran Guerra se extendió el cultivo en los países neutrales y fuera de Europa y a su término creció asimismo la producción francesa. El exceso de oferta favoreció la regulación oficial de los mercados por medio de diferentes instituciones, como las denominaciones de origen, las juntas reguladoras de precios, etc., que han pervivido y se han reforzado desde entonces.
Hacia 1919 —cuando acaba nuestro recorrido pictórico— los vinos se hallaban ya divididos en los cuatro grandes grupos que todavía podemos reconocer hoy: los vinos naturales superiores, los vinos generosos o encabezados o licorosos, los vinos espumosos y los vinos comunes o de pasto. Dentro de cada uno de esos grupos, salvo hasta cierto punto en el último, la viticultura y la enología científicas nos ofrecían entonces y nos ofrecen todavía en mucha mayor medida un sinnúmero de sensaciones y experiencias que otorgan toda su riqueza a una vieja bebida del Mediterráneo convertida en bebida universal. 
            ","vino"
