"","Artista","Obra","Fecha","Texto","Tema"
"10","David Teniers II","Fiesta campesina","hacia 1650","
                Un tratadista de la época, en la que se pintó esta obra, escribió: «El vicio de los habitantes de los Países Bajos es el exceso en la bebida, aunque en cierta medida se puede excusar a causa del clima, húmedo y melancólico». Las escenas festivas, al aire libre, con aldeanos y campesinos en sus momentos de ocio, entregados a sus pasatiempos favoritos, el baile y la bebida, se convirtieron en un género muy popular en los Países Bajos durante el siglo XVII, como testimonian otras obras de esta misma sala, como Boda campesina (c. 1649-1655), atribuida a Jan Havicksz. Steen, o Escena aldeana con hombres bebiendo (c.1631-1635), atribuida a Adriaen Brouwer. En ellas, el vino o la cerveza se convierten en elementos imprescindibles para reforzar lazos sociales, sellar tratos o, simplemente, manifestar la alegría de vivir.
Si durante el periodo preindustrial las mesas de nobles y patricios urbanos combinaban vinos de lujo, importados de otros países, con los vinos más sanos de entre los locales, donde los había, las mesas plebeyas también tenían sus propias formas de consumo. Desde luego en este terreno las diferencias entre las zonas productoras y las demás eran muy grandes. Donde había viñas, la cantidad consumida de vino era alta: en unos casos porque se trataba de la cosecha propia que no se vendía y en otros porque parte de las labores por cuenta ajena se remuneraban en especies. Aun así, los hogares pobres no tenían mucha capacidad de almacenamiento, y los jornales en especie y dinero no se prolongaban todo el año. Por ello, y porque era una forma de alargar la cantidad de vino, evitar la borrachera y conciliar la bebida con el trabajo físico, lo más frecuente era mezclar el vino con agua. También se recurría a los aguapiés, es decir, vinos inferiores obtenidos mediante la adición de agua a los hollejos pisados o a los restos del prensado.
El éxito de este tipo de escenas de género en la cultura visual neerlandesa de los siglos XVI y XVII se ha relacionado con el auge del mercado artístico vinculado a la burguesía urbana, que vería reflejadas en ellas ciertas preocupaciones éticas o sociales. El asunto, con su repertorio de personajes toscos y ruidosos que se dedican a beber sin freno, podría llevar implícito una crítica moralizante hacia los excesos y la falta de decoro. Pero, además de su posible propósito edificante, ha sido objeto de otras lecturas.
Tales escenas nos ofrecen, simultáneamente, una visión utópica y populista del mundo. Si las comparamos con el gran retrato de grupo de Franz Hals en el otro extremo de la sala, Grupo familiar ante un paisaje(c.1645-1648), quizás percibamos el contraste con el lenguaje más estructurado de la cultura oficial, dominado por las diferencias de rango y de privilegio inherentes a la jerarquía social. La fiesta popular supone una suspensión temporal del orden establecido y, a través de imágenes de exuberancia, una exaltación comunitaria de la fertilidad, el crecimiento y la abundancia, que nos recuerda la permanente tensión entre lo apolíneo y lo dionisíaco en la conducta humana. Como escribió el filósofo William James: «La sobriedad limita, discrimina y dice no; la ebriedad expande, une y dice sí». 
            ","vino"
"11","Gerrit van Honthorst","El violinista alegre con un vaso de vino","hacia 1624","
                «La música fue inventada para proporcionar felicidad al espíritu, al igual que el vino», escribe Cesare Ripa en su Iconología, un influyente libro de emblemas escrito en el siglo XVI. Desde tiempo inmemorial, una y otro se han estimulado mutuamente, como se aprecia en numerosas obras pictóricas que dan testimonio de este maridaje.
Honthorst, una de las grandes figuras de la Escuela de Utrecht y difusor del caravaggismo en Holanda, se caracteriza por una pintura llena de teatralidad y por acusados contrastes de luz, que le valieron el apodo de «Gherardo delle Notti». Se ha especulado con la posibilidad de que este tipo de figuras pudieran ser alegorías de los sentidos, representando, en el caso que nos ocupa, el gusto. Por otra parte, algunos lienzos de temática similar hacen pareja con figuras femeninas, estableciéndose en ellos un diálogo de gestos en los que cabría percibir una cierta carga erótica.
Cabe recordar la existencia en los países mediterráneos de una amplísima tradición popular de canciones relacionadas con la vendimia, que mezclan el vino con el amor y con el placer en la línea de las bacanales (con letras unas veces más «picantes» y otras más inocentes). También existía un género más moderno de canción de tabernas, propiamente masculino en sus contenidos y en su sentido, pues eran hombres los habituales de estos lugares. Hay asimismo una tradición musical culta que, inspirándose directamente en los motivos clásicos, une el vino con el amor e incluso con la inspiración.
En la misma sala el visitante podrá admirar un lienzo de uno de sus discípulos, Jan Gerrit van Bronchorst, Joven tocando la tiorba (c. 1642-1645), que muestra a un muchacho tañendo un instrumento semejante al laúd barroco, tocado con un gorro decorado con lo que parece ser una rama de vid, planta consagrada a Baco, el dios del vino. 
            ","vino"
"12","Jan Havicksz. Steen","Autorretrato con laúd","hacia 1663 - 1665","
                Jan Steen— conocido por sus jocosas escenas de género— procuró compatibilizar la pintura con otras actividades seguramente más lucrativas y cuya naturaleza no ha de sorprendernos a la vista de este retrato. Algunos años antes de la realización de esta obra regentó una taberna en Delft, La culebra, que no tuvo mucho éxito, y posteriormente abrió una fonda en Leiden y se dedicó a la fabricación de cerveza, oficio que ya había desempeñado su padre.
La cerveza, obtenida al igual que el vino a partir de la fermentación, aunque en su caso de cereales, ha mantenido a lo largo de la historia europea una relación de competencia con el vino. Producida en buena parte de Europa desde la Antigüedad, durante la Edad Media su prestigio era menor que el del vino y su consumo retrocedió frente al de éste, incluso en los países no productores. Hacia 1500, el vino seguía siendo la bebida de los más ricos en muchas regiones, sobre todo en el Norte de Europa, pero su consumo se había difundido en detrimento de la cerveza en las áreas productoras y en las comarcas fácilmente accesibles desde estas. Pero durante el siglo XVII—cuando Steen, futuro cervecero, se retrató con una jarra sobre la mesa— la cerveza recuperó terreno. Muchos viñedos alemanes fueron destruidos durante la guerra de los Treinta Años, por lo que el vino perdió posiciones en Centroeuropa. La «pequeña edad fría» del siglo XVII disminuyó la producción en muchas comarcas septentrionales del continente con idéntico resultado. Además hubo innovaciones importantes en la elaboración de cerveza. El lúpulo, cuyo uso se remontaba a la Baja Edad Media, se difundió por casi todas las zonas productoras, con lo que aumentó la duración de la cerveza y su sabor se acercó al actual. Diferentes aromas fueron además introducidos en el proceso productivo, en especial en Flandes y los Países Bajos, dando lugar a las cervezas aromáticas.
A lo largo de los siglos XVII y XIX, la producción de cerveza se industrializó, un proceso que abarató su producción y mejoró la bebida resultante, además se ampliaron las redes de distribución y comercialización que convirtieron definitivamente la cerveza en la bebida alcohólica por excelencia de todos los países europeos, al norte de la línea de producción de la vitivinicultura. Desde finales del siglo XIX, en algunos países mediterráneos, se extendió un nuevo modelo de establecimiento hostelero-productivo, la cervecería, muy difundida por entonces en la Europa Central. Las cervecerías, frecuentadas por la clase media, iniciaron la penetración de la cerveza en los países vinícolas, que se vería multiplicada en la segunda mitad del siglo XX.
Se ha establecido una conexión entre esta obra y uno de los emblemas de Ripa que representa la complexión sanguínea. El laúd, la jarra y el libro estarían en consonancia con la afición por la buena vida que se desprende de la imagen del pintor, en contraposición a la melancolía tradicionalmente identificada con el genio artístico. Otros habituales de las tabernas. aparecen en escenas de género de la Colección, como Fumadores en un interior (c. 1637), de David Teniers II, o Fumador, de un seguidor de Adriaen Brouwer, en las que se exalta la atmósfera de camaradería propiciada por el alcohol. 
            ","vino"
"13","Jacob Lucasz. Ochtervelt","Comiendo ostras","hacia 1665 - 1669","
                En esta escena, que bien pudiera estar ambientada en un burdel, Ochtervelt agrupa a sus tres personajes en torno a una mesa sobre la cual una de las mujeres coloca una bandeja de ostras, mientras que un caballero tañe un laúd y una dama se dispone a escanciar vino de una jarra. La música, el vino y las ostras —conocidas como minnekruyden o hierbas del amor a causa de su poder afrodisiaco— contribuyen a impregnar la atmósfera de erotismo. Como reza el proverbio latino, sine Cerere et Baco, friget Venus, es decir: «sin Ceres, diosa de los alimentos, y Baco, la personificación del poder desinhibidor del vino, Venus o el amor se enfría».
Los mensajes resumidos en las sentencias carpe diem(aprovecha el momento) y memento mori (recuerda que has de morir) coexisten en las obras pictóricas en las que el vino asume un papel protagonista en relación con la convivialidad. En algunas, ciertamente, se previene contra los peligros del exceso, aunque su principal intención parece ser la exaltación de los placeres derivados de la alegre compañía.
Desde el antiguo Egipto, las vides se han asociado con la fecundidad y con la reproducción de la vida: en muchas escenas funerarias egipcias, las cepas cargadas de hojas y frutos representaban la resurrección. Osiris, dios de la naturaleza, de la muerte y del renacer, era asimismo el dios de las viñas. Esta asociación con la fertilidad y con la regeneración, que encontramos en otras muchas religiones mediterráneas, otorgaban al vino una fuerte carga sexual. Desde luego más allá del simbolismo fácilmente atribuible a una planta que resurgía cada primavera a partir de troncos aparentemente muertos y que mantenía el verdor mientras todo a su alrededor se agostaba, las connotaciones eróticas del vino tienen que ver con su propiedades embriagantes, que lo convierten en una bebida capaz de hacer saltar las convenciones y facilitar la aproximación a los demás, incluida la sexual.
Los efectos depresores sobre el sistema nervioso central que causan las bebidas alcohólicas, provocando euforia y desinhibición, fueron considerados durante siglos un misterio, incluso entendidos como puerta a algún tipo de trascendencia, unida a la vida y a su reproducción, como se hacía en las fiestas dionisiacas griegas y en las bacanales romanas. Si con el cristianismo buena parte de estas tradiciones fueron dejadas de lado, la vinculación entre vino y vigor y deseo sexual no desapareció ni de los cuentos populares ni de la literatura médica. Precisamente por ello en la tradición de la Roma clásica pero también en la cristiana se tendía a condenar que las mujeres bebiesen vino, por cuanto que podían poner en riesgo su virtud y con ella el honor familiar. Una asociación negativa que volvió a aparecer con gran fuerza en las campañas y en la literatura antialcohólica del siglo XIX, al unir inmoralidad entre las mujeres y consumo de vino y, sobre todo, de otros licores.
En la Colección Carmen Thyssen-Bornemisza el visitante encontrará en la obra de Pieter Hendricksz. de Hooch, Interior con dos mujeres y un hombre bebiendo y comiendo ostras(1681), un tema semejante. 
            ","vino"
"14","Willem Claesz. Heda","Bodegón con pastel de frutas y diversos objetos","1634","
                Firmada y fechada en la hoja del cuchillo, «HEDA 1634», esta composición destaca por su gama monocromática de tonos grisáceos y pardos y por su virtuosa representación de las cualidades táctiles y de las distintas texturas: el brillo argénteo de la copa tumbada, la suave blancura del mantel, la luz filtrada a través de la copa llena de líquido dorado que permite al artista explorar los efectos de la trasparencia y del reflejo. Su virtuosismo nos invita a paladear la pintura y no solo a contemplarla.
La inclusión del vino en estos bodegones ofrecía al artista la oportunidad de representar una amplia variedad de recipientes de muy distinta forma, tamaño y material, como las copas Rummer o Römer, muy populares en Alemania y en los Países Bajos en los siglos XVII y XVIII (también presente en la obra de Jan Jansz. Treck, Bodegón con vaso de vino, jarra de peltre y otros objetos), o las copas nautilo, con forma de concha, uno de los motivos heredados de los vidrieros venecianos por los fabricantes de otros puntos de Europa tras el fin de su hegemonía en el siglo XVII. Los vasos vinarios han empleado a lo largo del tiempo múltiples materiales y han adoptado muchas formas. La cerámica, la madera, la piel e incluso el hueso eran los materiales con los que se hacían en la Edad Media los vasos más difundidos, mientras que nobles y burgueses preferían la plata: muchas de las piezas de plata que han sobrevivido son tan grandes que se piensa que probablemente eran utilizadas colectivamente. Sin embargo, en el siglo XVI, con el auge de los talleres venecianos, el vidrio sustituyó a la plata como material de distinción y se multiplicaron las formas.
Tras el desarrollo del cristal en la Inglaterra del Siglo XVI, nuevas copas, por lo general más finas, esbeltas y resistentes, se fueron difundiendo por toda Europa: solían estar ricamente ornamentadas, trasladando la herencia de las antiguas copas de plata y del mejor vidrio veneciano al cristal. A finales del siglo XVIII, se empezaron a diseñar copas diferentes para distintos tipos de vinos y otras bebidas, aunque la diferenciación de tamaños y formas en las cristalerías para contener diferentes vinos no se consolidó hasta el siglo siguiente.
            ","vino"
"15","Willem Kalf","Bodegón con porcelana y copa nautilo","1660","
                Las composiciones de Willem Kalf, maestro de lo que se dio en llamar pronkstilleven o naturalezas muertas ostentosas, por su énfasis en la sensualidad, son sintomáticas del nuevo orden socioeconómico europeo, cuando se está gestando la moderna economía de mercado. Evocan con brillantez las riquezas acumuladas por los acaudalados mercaderes holandeses: el cuenco chino, las copas de cristal, el nautilo y el tapiz persa, que aparecen una y otra vez en su producción. Se trata de objetos suntuarios a los que debió de tener fácil acceso por su actividad como marchante, y se sabe que en ocasiones le fueron prestados por coleccionistas.
En cuanto a las asociaciones simbólicas que puedan emanar de estas piezas, se ha mencionado el paso del tiempo por la presencia del reloj abierto en el ángulo izquierdo de la mesa, así como la fugacidad de la vida por las pepitas, los restos de frutas y el vaso roto. También la copa de vino nos habla del eterno combate contra el tiempo, que destruye y deteriora, pero cuyo trascurso ejerce igualmente un efecto bienhechor, al permitir al vino adquirir su bouquet característico.
Un elemento recurrente es el limón pelado, dotado de múltiples y muy versátiles implicaciones. La espiral de su piel al borde de la mesa, en precario equilibrio, contribuye a la sensación de dinamismo y aporta una nota de vivo color. El fruto se prestaba a otro tipo de interpretaciones simbólicas: del mismo modo que su rugosa piel esconde un fragante interior, el cuerpo perecedero alberga un alma inmortal; por otra parte, era símbolo de templanza y moderación pues, según se creía, su jugo contrarrestaba los efectos del alcohol.
Kalf modula la iluminación complaciéndose en el sutil juego de reflejos e irisaciones: la luz envuelve los objetos a la vez que nos va desvelando las calidades y los colores. Mitiga el tono de las copas venecianas y, para equilibrar su delicada apariencia, resalta el brillo del cuenco de porcelana y la textura de la fruta, ofreciendo a nuestra mirada un festín visual que estimula nuestro apetito. 
            ","vino"
"16","Nicolas-Bernard Lépicié","El patio de la aduana","1775","
                La obra de Lépicié, que fue expuesta en el Salón de 1775, donde suscitó comentarios elogiosos por parte de Diderot, es una exaltación de las virtudes del comercio y del sistema aduanero. El lienzo fue encargado por el abad Terray (quien ha sido identificado como el clérigo vestido de negro), poco después de ser relevado de su cargo de contrôleur-général des finances, y representa una visión de la actividad económica de Francia en los inicios del reinado de Luis XVI: las carretas cargadas de fardos aguardan a ser inspeccionadas, se pesan los barriles de vino y en primer plano tres hombres inspeccionan una caja de libros, dándose a entender que todos los productos, desde la óptica mercantilista, habían de estar sometidos a control.
Los impuestos indirectos, los recaudados a partir del comercio y de otros signos indirectos de riqueza, fueron desde la Baja Edad Media y hasta el siglo XX la base fundamental de los fiscos reales, señoriales y municipales europeos. El vino, una mercancía ampliamente difundida y fácilmente localizable por los recaudadores, constituyó uno de los artículos gravados y muy a menudo una de las principales fuentes de ingresos de cualquier hacienda. Por lo general el vino era gravado no en los puntos de consumo sino en puentes, puertos, puertas y pasos obligados de carros y caballerías.
En los países productores, las ciudades, que eran los principales centros de consumo, estuvieron a menudo rodea- das de cercas fiscales que forzaban el tránsito y liquidaban los impuestos correspondientes. En los países no productores abastecidos por mar y en las ciudades a las que el vino llegaba por los ríos, las monarquías establecieron aduanas marítimas o aduanas secas que recaudaban los impuestos sobre el vino y las restantes bebidas alcohólicas, además de sobre otros productos.
Por la facilidad recaudatoria, los impuestos sobre el vino fueron justificados en que constituían un gravamen sobre un bien consumido en cantidades muy superiores por los más ricos, y a su vez como un instrumento de lucha contra los excesos en el consumo. A partir del siglo XIX, según adquirieron fuerza los movimientos anti alcohólicos, los tributos sobre las bebidas alcohólicas pasaron a presentarse como instrumentos de una política sanitaria contra el alcoholismo. Pero en los países productores, los impuestos sobre el alcohol distinguieron el vino, la cerveza y la sidra de las bebidas destiladas consideradas mucho más nocivas. Sin embargo, en general, la imposición diferencial del vino ha contribuido a lo largo de la historia a configurar la demanda: en la Inglaterra del siglo XVIII la penalización de los vinos franceses abrió la puerta al auge del oporto y luego del jerez. Por el contrario, la utilización en diferentes países desde mediados del siglo XIX de impuestos que gravaban el grado alcohólico/volumen en vez del volumen de líquido contribuyó al declive de los vinos generosos y favoreció el auge de los vinos naturales. Resulta de interés saber que esta obra perteneció a la colección de James de Rothschild, magnate que en en1868 adquirió Château Lafite, uno de las más destacados viñedos de Francia, situado en la región de Burdeos. 
            ","vino"
"17","Jean-Honoré Fragonard","El columpio","hacia 1750 - 1752","
                 El columpio ha sido considerado como un precedente para una de las obras más célebres de Fragonard, del mismo título, hoy en la colección Wallace de Londres. El artista despliega en el lienzo toda la exquisita ligereza, el hedonismo y la joie de vivre que le caracterizan, combinando un sutil tono erótico con el amor por la naturaleza.
Acompañan a la pareja dos amorcillos y un bodegón con apetitosas frutas y una botella de vino, alusivas al juego amoroso. En el mundano siglo XVIII,la mujer asume un nuevo protagonismo y una mayor libertad de costumbres. Como se lamenta la Princesa Liselotte del Palatinado unos años antes de que se realizara esta composición: «Hoy en día, la última moda en París es que las damas se emborrachen igual que los hombres y cometan toda suerte de actos deshonrosos y de desmanes».
La instalación de la corte de la monarquía absoluta en Versalles a finales del siglo XVII abrió un periodo de apogeo de la gran cocina francesa, de un refinamiento y un lujo extremos. En ese contexto hay que enmarcar diversas novedades como la extensión de las botellas y de los corchos, que permitieron a su vez el envejecimiento o añejamiento del vino. Hasta entonces, las botellas se empleaban nada más que para servir el vino conservado en barricas o en otros recipientes, tanto en las casas como en los comercios. Con la mejora de la tecnología del vidrio y gracias a la difusión en el siglo XVII de las técnicas venecianas a otros países en las que fueron desarrolladas, las botellas se hicieron más sólidas y su producción más barata, con lo que se volvió posible almacenarlas llenas en las bodegas. De ese modo se fue descubriendo el potencial que abría la crianza en botella de determinados vinos. No obstante, en el siglo XVII la distribución se seguía haciendo en barriles y eran las casas más ricas las que embotellaban el vino para su conservación, a menudo en botellas propias. Únicamente en la segunda mitad del siglo XIX se empezó a extender entre los vinos superiores la fórmula de embotellar y criar el vino en bodega, tras el añejamiento en barrica, y la consiguiente comercialización del vino ya embotellado. La mayor solidez de las botellas trajo consigo la aparición de un nuevo tipo de vino: el champán.
En la segunda mitad del siglo XVII la combinación de los experimentos llevados a cabo en la región de Reims, como los atribuidos a Dom Pérignon —alrededor del cual se gestó una auténtica leyenda en el siglo XIX—, y la mejora de las botellas permitió que se introdujera la técnica de la segunda fermentación en botella, de la que se deriva el vino espumoso. El champán se convirtió en una bebida de moda en el Londres de la Restauración en la década de1670, adonde llegó de la mano de aristócratas franceses originarios de la Champaña, y luego, ya en el siglo XVIII en Francia, bajo la regencia del duque de Orleans a la muerte de Luis XIV en 1715. Pese a los avances, por aquel entonces las botellas de champán estallaban hasta en un 50% de los casos y la producción era muy limitada. Únicamente en la primera mitad del siglo XIX, los cambios en la elaboración, en las maquinas de embotellado, en la forma de los corchos y en las propias botellas se aunaron para dar lugar a la industria champañera francesa, cuyo éxito alentó la extensión del méthode champenoise a otros países. 
            ","vino"
