"","Artista","Obra","Fecha","Texto","Tema"
"17","Richard Estes","Nedick's","1970","
                La cadena Nedick´s nació en nueva York en la década de 1920 y en poco tiempo se convirtió en uno de los iconos de la ciudad. En aquella época se estaba produciendo un cambio radical en los hábitos culinarios como resultado de la transformación de los procesos de elaboración y distribución en la industria alimentaria, a su vez motivados por complejos fenómenos como la industrialización, la incorporación masiva de la mujer al mercado de trabajo, la obsesión por la higiene, la voracidad consumista y la falta de tiempo para interrumpir el proceso productivo que impulsaba a los oficinistas que trabajaban en el centro de la ciudad a comer tan rápido como les fuera posible.
¿Y quién era capaz de servir un menú completo —hamburguesa, coca-cola y patatas fritas— en segundos? Nedick’s, pionera de la comida rápida hasta ser desbancada por su rival McDonald’s, cuyo primer autoservicio se abrió en Pasadena, California, en 1937, en respuesta a la dependencia que tenían sus habitantes del automóvil. Años después nacerían las cadenas que explotaban el filón «étnico»: pizzas napolitanas, tacos mejicanos, ramen japoneses, todos idénticos, sin sorpresas y por tanto sin personalidad.
Sin embargo, no sólo el precio, la celeridad o la funcionalidad han contribuido a su éxito. El transgresor placer de comer con las manos, las texturas crujientes o suaves y el sabor agridulce de las salsas reproducen sensaciones orales y placeres gustativos de la infancia, que es cuando se forja el paladar.
            ","gastronomía"
