"","Artista","Obra","Fecha","Texto","Tema"
"10","Edgar Degas","En la sombrerería","1882","
                Degas fue el primogénito de una adinerada familia. Abandonó tempranamente los estudios de Derecho para dedicarse a la pintura. Artista que estuvo siempre vinculado al grupo impresionista, aunque se veía a sí mismo como un pintor realista. Durante toda su carrera se interesa por el universo femenino y especialmente por el mundo de la moda, lo que le llevará a realizar una serie adentrándose en el París de la alta costura, y para ello visitará las boutiques acompañado por sus amigas. Desde el punto de vista social, el Impresionismo fue el movimiento artístico del progresivo bienestar de la clase media. Las jóvenes burguesas de París serán las protagonistas de estos cuadros, disfrutando del tiempo libre y de su incipiente libertad, comienzan a ser esclavas de la moda.
Con el proceso de industrialización y la consiguiente producción en masa, lucir prendas sofisticadas se hizo accesible a una población cada vez mayor.
Esta es la primera obra de la serie de pasteles dedicados a las sombrererías de París. Cuando se expuso provocó una crítica feroz por la rapidez en representar las sedas, plumas, el raso y la paja. Las formas y materiales de los sombreros permiten al artista mostrar su faceta más colorista con brillantes juegos cromáticos y una excelente captación de las texturas.
Las sombrererías se situaban en las calles más elegantes de París, y éstas fueron a su vez protagonistas de lienzos como Rue Saint-Honoré por la tarde. Efecto de lluvia de Camille Pissarro, que vemos en la misma sala.
En el cuadro aparecen dos tipos de sombreros de paja: el sombrero de ala adornado de flores y plumas para pasear bajo el sol de los jardines y el sombrero capota, sujeto con cintas por debajo de la barbilla, que envuelve completamente la cabeza impidiendo la visibilidad lateral. Tiene su precedente en las cofias de siglos anteriores.
El uso de la sombrilla se generaliza de forma definitiva a partir de 1830. Desde entonces y durante casi un siglo, se convierte en un objeto indispensable para las mujeres. Los parasoles proporcionaban un toque de elegancia tanto por la riqueza y variedad de sus materiales como por las peculiaridades de su manejo. A lo largo del siglo XIX las normas de la elegancia y el decoro se ocuparon de regular su uso. Junto con el abanico, los guantes y el pañuelo, la sombrilla contó con su propio lenguaje.
Otro ejemplo, Mujer con sombrilla en un jardín de Pierre-Auguste Renoir, en la sala anterior, nos muestra la importancia de la sombrilla en el universo femenino.
            ","moda"
"11","Lovis Corinth","Desfile de modelos","1921","
                Lovis Corinth fue un artista alemán que viaja a París atraído por los impresionistas; a su regreso será nombrado profesor de la Academia en Berlín. Desfile de modelos fue pintado en Berlín sólo cuatro años antes de morir.
Los desfiles de moda tienen su origen en 1800 con ocasión de los Salones de costura. Paul Poiret creó en París a principios del siglo XX la silueta de la mujer moderna. Elimina el corsé, retoma la línea recta e implanta las medias de seda color carne. Poiret también fue pionero en lanzar su propio perfume, realizar giras para promocionar sus diseños, servirse de la publicidad para difundir su calidad estética y utilizar nueve modelos para mostrar su trabajo en un desfile. Incluso a modo de performance llegó a diseñar un traje en pocos minutos delante del público con tijeras, tela y alfileres en mano.
El cuadro de Corinth capta un desfile de moda: la retratada posa, mostrando un fular que envuelve su cuerpo. El vestido de seda amarillo tiene forma de tubo y llega casi a los tobillos. El traje con corte en la cintura a la altura de las caderas es un rasgo característico de esta década, en la cual el cuerpo se asemejaba a un cilindro. En pocos años la parafernalia femenina pasa de tres kilos de ropa a 900 gramos. Tras la eliminación del corsé, el busto se contenía bajo la modestia hasta la aparición del sostén, prenda indispensable para redondear y dar volumen al busto.
La verdadera revolución ocurrió en 1925 con la aparición de la falda corta. El arzobispo de Nápoles llegó a insinuar que el terremoto de Amalfi se debía a la ira de Dios contra la falda que no llegaba más allá de la rodilla. En Utah se publicó un decreto por el que se multaría y apresaría a aquellas mujeres con faldas a más de tres pulgadas de los tobillos. Y en Ohio se pretendía prohibir a cualquier mujer de más de catorce años llevar una falda que no tocase el empeine.
Todo fue inútil, el camino para la emancipación estaba abierto. Durante «Los locos años 20» la mujer abandona el hogar y decide tener una actividad social más activa. Es una década de baile y desenfreno, es la época del charlestón. La imagen femenina adopta la forma de un rectángulo con el talle en las caderas, por lo que la geometría será motivo principal en el diseño de la indumentaria.
El crack de 1929 supuso la introducción de nuevos tejidos, más finos y económicos, lo que facilitó mayor flexibilidad en los movimientos, en especial para practicar deporte. Se fabrican tejidos sintéticos y de punto. En 1933 aparece el pantalón corto en las tenistas, y enseguida se quitan las medias en Wimbledon, causando un gran revuelo entre el público.
            ","moda"
"12","Max Beckmann","Quappi con suéter rosa","1932 - 1934","
                Esta sala reúne una serie de retratos de mujeres modernas, cuyo atuendo refleja su personalidad. En el periodo de entreguerras nace un nuevo estilo de mujer.
El nuevo ideal femenino era andrógino, las mujeres se esforzaban por parecer masculinas. Las curvas se ocultan, se vendan los senos para disminuir el volumen, desciende el talle y la mujer se incorpora al mundo laboral. La nueva tendencia en el peinado es la melena corta, y después el pelo a lo garçonne, bautizado así por una novela de Victor Margueritte, rodeada de gran escándalo: La Garçonne (1922), que relata los esfuerzos de una joven por escapar de la norma y vivir su propia vida. Este corte de pelo marcaba fielmente las líneas de la cabeza y quedaba reforzado con la cloche, el sombrero de moda.
En París varias firmas cerraron sus puertas apareciendo nuevos talentos femeninos con tendencias revolucionarias, como Coco Chanel y Elsa Schiaparelli, grandes rivales, que no fueron meras diseñadoras, sino creadoras de todo un movimiento artístico y amigas de los más importantes intelectuales del momento. Los diseños de Schiaparelli se vieron influenciados por los surrealistas, como Salvador Dalí y Alberto Giacommetti. Cabe destacar sus sobreros zapato. La diseñadora italiana consiguió abrir veintiséis talleres que emplearon a más de dos mil personas. En 1930 se estima que su boutique tenía un volumen de ventas de veinte millones de francos al año.
Esta excepcional imagen es un magnífico ejemplo del estilo de Max Beckmann. El retrato se expuso en Nueva York una sola vez en 1938. Quappi, se convirtió en 1925 en su segunda y definitiva esposa. La obra fue comenzada en 1932 y finalizada en 1934, cuando Beckmann cambió la fecha junto con la expresión de Quappi, haciendo su sonrisa más comedida y más acorde con la preocupación de la pareja ante la llegada de los nazis al poder.
Contemplamos a Quappi seductora, ha perfilado y coloreado sus labios y sus pómulos, se ha depilado las cejas y viste un traje sastre (dos piezas) y suéter rosa con cuello en forma de V, denunciado por los médicos como un peligro para la salud y conocido irónicamente como «blusa pulmonía».
""""A veces una prenda de vestir inspira a Max un cuadro mío"""", dice Matilde Beckmann en sus memorias. Esta vez fue un suéter y turbante rosa que ella misma compra en Berlín. A lo largo de su carrera Max retrata a su mujer más de cincuenta veces. Esta obra era conocida bajo el título de La americana, por su aire de mujer moderna, sofisticada y sensual en su pose.
En la misma sala encontramos retratos de otras mujeres modernas, que se independizan de sus maridos, que visten con falda corta y medias sintéticas, como el Doble retrato de Hilde II de Karl Hubbuch; y retratos masculinos que reflejan la escasa evolución del traje de salón, rey indiscutible en el vestuario de los caballeros. La única modificación y variante en el traje es la chaqueta: cruzada, recta, con chaleco, como se observa en El retrato del Dr. Haustein de Christian Schad y en Hugo Erfurth con perro de Otto Dix.
            ","moda"
"13","Juan Gris","El fumador (Frank Haviland)","1913","
                El fumador fue pintado en Céret, localidad del Pirineo francés conocida como «La Meca del Cubismo», durante una estancia en la que Juan Gris coincidió unos días con Picasso, a quien llamaba «maestro ». La desfragmentación geométrica enlaza directamente con la serie de Cabezas de Picasso pintadas ese mismo año.
Gracias a la conservación de un dibujo preparatorio con dedicatoria se baraja la hipótesis de que sea un retrato de Frank Haviland, un rico americano, amigo de los Stein, que acababa de restaurar un monasterio en Céret, en el que guardaba su importante colección de arte africano.
Analizando los planos fragmentados en el lienzo y recomponiéndolos conceptualmente, descubrimos la imagen de un hombre fumando que viste esmoquin con sombrero de copa.
Este traje, que surgió en Gran Bretaña en el siglo XIX, se utilizaba específicamente para fumar y más tarde se consideraría traje de etiqueta masculino. Habitualmente se realiza en tela negra, con detalles de satén en chaqueta y pantalón. Los caballeros, tras la cena, se ponían aquella peculiar chaqueta —«smoking jacquet»— en sustitución de su levita para no impregnarla de humo y no molestar con el olor a las damas. Pronto surgió el Fumoir, lugar privado donde se reunían los hombres para fumar, una actividad entonces asociada al lujo y a lo exclusivo, ya que, si bien el tabaco se trajo a Europa después de la conquista de América, el fumar cigarros se puso de moda precisamente en ese siglo gracias a su importación masiva de Turquía.
Las mujeres comienzan a fumar en 1925 y el esmoquin dejo de considerarse un traje exclusivamente masculino. En la década de 1930 el modelo a seguir eran las actrices. Ninguna mujer, excepto Marlene Dietrich en El ángel azul, de 1930, había osado ponerse semejante atuendo masculino. Greta Garbo, en sus años gloriosos, también se atrevió con esta prenda en sus salidas nocturnas por la Costa Azul. No en vano dice Helmut Newton, fotógrafo de moda, ""No hay nada más sensual que una mujer alta, esbelta y poderosa, sobre un buen par de tacones, luciendo un esmoquin prestado del guardarropa varonil"".
El esmoquin femenino sigue marcando estilo, especialmente desde 1966, cuando Yves Saint-Laurent reinterpreta el tradicional atuendo masculino en clave femenina, convirtiéndolo con el tiempo en un clásico, una pieza de fondo de armario para la mujer.
            ","moda"
"14","Sonia Delaunay","Vestidos simultáneos. (Tres mujeres, formas, colores)","1925","
                La moda, al igual que otros campos del entorno visual, se vio afectada por los experimentos formales de las vanguardias de principios siglo XX. En este periodo surge el esfuerzo por alcanzar el reconocimiento de la moda como un arte.
El matrimonio Delaunay, pionero de la abstracción, reivindicó la importancia del color en la pintura como generador de formas y movimiento. Elaboraron el concepto de Simultaneísmo, basado en el dinamismo y los contrastes del color. Sonia tuvo éxito como pintora pero su gran aportación fue en el universo de las artes decorativas y el diseño textil. Traba- ja con tejidos y tapices estampados a mano, crea diseños para cortinas, paraguas, muebles, cojines, libros, lámparas..., deja huella en el ámbito de la moda y decoración de interiores por su gran creatividad. Las combinaciones de color rompían cualquier forma de corte bien definido, y la mezcla de telas distintas con texturas variadas contribuía a esa ruptura formal. En una revista en 1913 declaraba: «Quería crear algo nuevo y moderno, el color se escapa de los cuadros».
El estallido de la Primera Guerra Mundial sorprende a los Delaunay veraneando en España. En 1918 se instalan definitivamente en Madrid hasta 1921 y abren su propia boutique cerca de Serrano bajo el nombre de Casa Sonia. La exitosa fórmula se repetirá en Bilbao, San Sebastián y Barcelona. Desde allí colaboran con los Ballets de Diaghilev, Sonia diseña el vestuario y Robert hace los decorados. En el Hotel Claridge de Madrid se presentaron muchos de sus pases de modelos. En 1921 regresan a París creando la mítica Boutique Simultánea, un espacio híbrido a medio camino entre galería de arte y tienda de ropa. El sentido de la moda que Sonia introduce sintoniza con las inquietudes sociales y de cambio del momento. Contemplando el cuadro las modelos lucen vestidos simultáneos de vivos estampados.
Esta prenda era, en realidad, una obra de arte producida sobre un soporte diferente al lienzo. En 1913 realizará su primer vestido simultáneo y pocos años después lanzará el vestido-poema. Las mujeres que vestían los diseños de Sonia son pinturas vivientes, la obra de arte está en el cuerpo femenino, es tridimensional y se mueve. Su éxito será rotundo al vestir a actrices de moda como Gloria Swanson. Valiente, atrevida y visionaria, Sonia Delaunay llegará a diseñar estampados para automóviles de Citroën y será la primera mujer que vio en vida sus cuadros expuestos en el Museo del Louvre de París.
            ","moda"
"15","Piet Mondrian","New York City, 3 (inacabado)","1941","
                En el año 1938, a la vista del avance nazi, Piet Mondrian decidió abandonar París y trasladarse a Londres. En 1940 se instaló en Nueva York, donde pasaría los últimos años de su vida. París cayó, pero la moda sobrevivió, desafiando la falta de tejidos, procesos de manufactura y mano de obra, etc.
En Estados Unidos la contienda tuvo menor impacto que en Europa y la moda evolucionó rápidamente de la mano de la industria cinematográfica. En 1944 Ginger Rogers luce en Una mujer en la penumbra un traje de baile anunciado como el vestido más caro del mundo, su coste ascendía a 35.000 dólares.
Mondrian se deja seducir por la cultura americana, el jazz, el boogie-woogie, el dinamismo de la metrópolis y los rascacielos de Manhattan. Su pintura pierde rigidez y gana libertad y ritmo, como muestra en New York City 3, realizada unos años antes de su muerte.
En este momento, gracias al sentido práctico de diseñadoras como Coco Chanel, la indumentaria se pone al servicio de la simplicidad y la funcionalidad. Sus diseños reflejan las pinturas geométricas de Mondrian o las líneas puras de la arquitectura de Le Corbusier, despojadas de todo ornamento. El mítico frasco de perfume Chanel Nº 5, supone toda una declaración de principios: el diseño, reducido a una sencilla forma geométrica y a un número, transmite un mensaje de gran modernidad. La esencia de su estilo influirá en la generación siguiente con Christian Dior y su discípulo Yves Saint Laurent.
La composición abstracta de líneas sencillas y rectas de Mondrian también inspirará a Yves Saint Laurent en su colección de 1965, que constituyó un éxito de ventas y sería reproducida e imitada hasta la saciedad.
El mundo entero aplaudirá estas creaciones que traspasan los límites entre géneros artísticos, adaptando el lenguaje plástico a la moda. A lo largo de su carrera el diseñador dialogará en sus colecciones como Van Gogh, Matisse y Picasso. La idea del diseño y la estampación de tejidos como obra de arte permanece viva en las creaciones de los diseñadores actuales. Hoy la moda se expone en los museos y las grandes firmas buscan a sus artistas capaces de crear verdaderas obras de arte en el vestir.
            ","moda"
